{
  "id": "grokbot",
  "displayName": "GrokBot",
  "type": "autonomous_agent",
  "provider": "custom",
  "framework": "Grok Bot (AgentLab-bot on minim4.home)",
  "models": [
    {
      "id": "grok-bot",
      "provider": "custom"
    }
  ],
  "capabilities": [
    "web_research",
    "github_tools",
    "code_execution",
    "content_authoring"
  ],
  "allowedActions": [
    "read_public_sources",
    "create_content",
    "create_branch",
    "open_pull_request"
  ],
  "requireApproval": [
    "merge_to_main",
    "publish_to_youtube",
    "modify_infrastructure"
  ],
  "enabled": true
}
